<?xml version="1.0" encoding="ISO-8859-1"?>

<!DOCTYPE resource-adaptor-type-jar PUBLIC "-//Sun Microsystems, Inc.//DTD JAIN SLEE Resource Adaptor Type 1.0//EN" "http://java.sun.com/dtd/slee-resource-adaptor-type-jar_1_0.dtd">

<resource-adaptor-type-jar>
    <description />
    <resource-adaptor-type>
        <description>Rules resource adaptor type</description>
        <resource-adaptor-type-name>
            RulesResourceAdaptorType
        </resource-adaptor-type-name>
        <resource-adaptor-type-vendor>
            org.mobicents
        </resource-adaptor-type-vendor>
        <resource-adaptor-type-version>
            1.0
        </resource-adaptor-type-version>
        <resource-adaptor-type-classes>
            <activity-type>
                <activity-type-name>
                    org.mobicents.slee.resource.rules.ratype.RulesSession
                </activity-type-name>
            </activity-type>
            
            <activity-context-interface-factory-interface>
                <activity-context-interface-factory-interface-name>
                    org.mobicents.slee.resource.rules.ratype.RulesActivityContextInterfaceFactory
                </activity-context-interface-factory-interface-name>
            </activity-context-interface-factory-interface>
            
            <resource-adaptor-interface>
                <resource-adaptor-interface-name>
                    org.mobicents.slee.resource.rules.ratype.RulesProvider
                </resource-adaptor-interface-name>
            </resource-adaptor-interface>
        </resource-adaptor-type-classes>        
        
        <event-type-ref>
            <event-type-name>
                org.mobicents.slee.rules.FactAsserted
            </event-type-name>
            <event-type-vendor>org.mobicents</event-type-vendor>
            <event-type-version>1.0</event-type-version>
        </event-type-ref>
    </resource-adaptor-type>
</resource-adaptor-type-jar>
