<?xml version="1.0" encoding="ISO-8859-1"?>

<!DOCTYPE resource-adaptor-type-jar PUBLIC "-//Sun Microsystems, Inc.//DTD JAIN SLEE Resource Adaptor Type 1.0//EN" "http://java.sun.com/dtd/slee-resource-adaptor-type-jar_1_0.dtd">

<resource-adaptor-type-jar>
	<description />
	<resource-adaptor-type>
		<description>Dummy resource adaptor type</description>
		<resource-adaptor-type-name>
			DummyResourceAdaptorType
		</resource-adaptor-type-name>
		<resource-adaptor-type-vendor>
			org.mobicents
		</resource-adaptor-type-vendor>
		<resource-adaptor-type-version>
			1.0
		</resource-adaptor-type-version>
		<resource-adaptor-type-classes>
			<activity-type>
				<activity-type-name>
					org.mobicents.slee.resource.dummy.ratype.DummyActivity
				</activity-type-name>
			</activity-type>

			<activity-context-interface-factory-interface>
				<activity-context-interface-factory-interface-name>
					org.mobicents.slee.resource.dummy.ra.DummyActivityContextInterfaceFactoryImpl
				</activity-context-interface-factory-interface-name>
			</activity-context-interface-factory-interface>

			<resource-adaptor-interface>
				<resource-adaptor-interface-name>
					org.mobicents.slee.resource.dummy.ra.DummyResourceAdaptor
				</resource-adaptor-interface-name>
			</resource-adaptor-interface>
		</resource-adaptor-type-classes>


		<event-definition>
			<event-type-name>
				org.mobicents.slee.resource.dummy.Event
			</event-type-name>
			<event-type-vendor>net.java</event-type-vendor>
			<event-type-version>1.0</event-type-version>
		</event-definition>
	</resource-adaptor-type>
	<event-definition>
		<event-type-name>
			org.mobicents.slee.resource.dummy.Event_2
		</event-type-name>
		<event-type-vendor>net.java</event-type-vendor>
		<event-type-version>1.0</event-type-version>
	</event-definition>
	<event-definition>
		<event-type-name>
			org.mobicents.slee.resource.dummy.Event_3
		</event-type-name>
		<event-type-vendor>net.java</event-type-vendor>
		<event-type-version>1.0</event-type-version>
	</event-definition>
	<event-definition>
		<event-type-name>
			org.mobicents.slee.resource.dummy.Event_4
		</event-type-name>
		<event-type-vendor>net.java</event-type-vendor>
		<event-type-version>1.0</event-type-version>
	</event-definition>
	<event-definition>
		<event-type-name>
			org.mobicents.slee.resource.dummy.Event_5
		</event-type-name>
		<event-type-vendor>net.java</event-type-vendor>
		<event-type-version>1.0</event-type-version>
	</event-definition>
</resource-adaptor-type-jar>

