<?xml version="1.0" encoding="ISO-8859-1"?>
<!DOCTYPE resource-adaptor-type-jar PUBLIC "-//Sun Microsystems, Inc.//DTD JAIN SLEE Resource Adaptor Type 1.0//EN" "http://java.sun.com/dtd/slee-resource-adaptor-type-jar_1_0.dtd">

<resource-adaptor-type-jar>
	<description />
	<resource-adaptor-type>
		<description>Dummy resource adaptor type</description>
		<resource-adaptor-type-name>DummyResourceAdaptorType</resource-adaptor-type-name>
		<resource-adaptor-type-vendor>${groupId}</resource-adaptor-type-vendor>
		<resource-adaptor-type-version>${version}</resource-adaptor-type-version>
		<resource-adaptor-type-classes>
			<activity-type>
				<activity-type-name>${package}.DummyActivity</activity-type-name>
			</activity-type>
			<activity-context-interface-factory-interface>
				<activity-context-interface-factory-interface-name>${package}.DummyActivityContextInterfaceFactory</activity-context-interface-factory-interface-name>
			</activity-context-interface-factory-interface>
		</resource-adaptor-type-classes>

		<event-type-ref>
			<event-type-name>${package}.Event</event-type-name>
			<event-type-vendor>${groupId}</event-type-vendor>
			<event-type-version>${version}</event-type-version>
		</event-type-ref>
		<event-type-ref>
			<event-type-name>${package}.Event_2</event-type-name>
			<event-type-vendor>${groupId}</event-type-vendor>
			<event-type-version>${version}</event-type-version>
		</event-type-ref>
		<event-type-ref>
			<event-type-name>${package}.Event_3</event-type-name>
			<event-type-vendor>${groupId}</event-type-vendor>
			<event-type-version>${version}</event-type-version>
		</event-type-ref>
		<event-type-ref>
			<event-type-name>${package}.Event_4</event-type-name>
			<event-type-vendor>${groupId}</event-type-vendor>
			<event-type-version>${version}</event-type-version>
		</event-type-ref>
		<event-type-ref>
			<event-type-name>${package}.Event_5</event-type-name>
			<event-type-vendor>${groupId}</event-type-vendor>
			<event-type-version>${version}</event-type-version>
		</event-type-ref>
	</resource-adaptor-type>
</resource-adaptor-type-jar>

